{
  "schema_version": "vNext",
  "artifact_id": "VAL-AI-CUSTOMER-SUPPORT-VNEXT",
  "artifact_version": "vNext",
  "status": "PASS",
  "validation_errors": [],
  "assertions": [
    {
      "assertion": "exact_required_transform_whitelist",
      "status": "PASS",
      "field": "caller",
      "destination": null,
      "rule": "EXACT_REQUIRED_NO_LOSSY_TRANSFORM",
      "detail": "method=PASS_THROUGH"
    },
    {
      "assertion": "internal_only_external_destination_blocked",
      "status": "PASS",
      "field": "caller",
      "destination": null,
      "rule": "INTERNAL_ONLY_NO_EXTERNAL_DESTINATION",
      "detail": "external_destinations=[]"
    },
    {
      "assertion": "transform_method_allowed_for_requirement",
      "status": "PASS",
      "field": "caller",
      "destination": null,
      "rule": "TRANSFORM_METHOD_REQUIREMENT_COMPATIBILITY",
      "detail": "method=PASS_THROUGH requirement=EXACT_REQUIRED"
    },
    {
      "assertion": "minimization_has_explicit_method_or_gap",
      "status": "PASS",
      "field": "caller",
      "destination": null,
      "rule": "MINIMIZATION_REQUIRES_EXPLICIT_METHOD_OR_CONTRACT_GAP",
      "detail": "method=PASS_THROUGH"
    },
    {
      "assertion": "external_response_not_pre_execution_request",
      "status": "PASS",
      "field": "caller",
      "destination": null,
      "rule": "SOURCE_PHASE_RESPONSE_SEPARATION",
      "detail": "source_phase=PRE_EXECUTION source_type=CALLER_CONTEXT"
    },
    {
      "assertion": "trace_reference_present",
      "status": "PASS",
      "field": "caller",
      "destination": null,
      "rule": "TRACE_REFERENCE_REQUIRED",
      "detail": ""
    },
    {
      "assertion": "classification_basis_present",
      "status": "PASS",
      "field": "caller",
      "destination": null,
      "rule": "VALIDATION_ARTIFACT_REFERENCE_REQUIRED",
      "detail": "basis=['EVAL-AI-001']"
    },
    {
      "assertion": "exact_required_transform_whitelist",
      "status": "PASS",
      "field": "role",
      "destination": null,
      "rule": "EXACT_REQUIRED_NO_LOSSY_TRANSFORM",
      "detail": "method=PASS_THROUGH"
    },
    {
      "assertion": "internal_only_external_destination_blocked",
      "status": "PASS",
      "field": "role",
      "destination": null,
      "rule": "INTERNAL_ONLY_NO_EXTERNAL_DESTINATION",
      "detail": "external_destinations=[]"
    },
    {
      "assertion": "transform_method_allowed_for_requirement",
      "status": "PASS",
      "field": "role",
      "destination": null,
      "rule": "TRANSFORM_METHOD_REQUIREMENT_COMPATIBILITY",
      "detail": "method=PASS_THROUGH requirement=EXACT_REQUIRED"
    },
    {
      "assertion": "minimization_has_explicit_method_or_gap",
      "status": "PASS",
      "field": "role",
      "destination": null,
      "rule": "MINIMIZATION_REQUIRES_EXPLICIT_METHOD_OR_CONTRACT_GAP",
      "detail": "method=PASS_THROUGH"
    },
    {
      "assertion": "external_response_not_pre_execution_request",
      "status": "PASS",
      "field": "role",
      "destination": null,
      "rule": "SOURCE_PHASE_RESPONSE_SEPARATION",
      "detail": "source_phase=PRE_EXECUTION source_type=ROLE_BINDING"
    },
    {
      "assertion": "trace_reference_present",
      "status": "PASS",
      "field": "role",
      "destination": null,
      "rule": "TRACE_REFERENCE_REQUIRED",
      "detail": ""
    },
    {
      "assertion": "classification_basis_present",
      "status": "PASS",
      "field": "role",
      "destination": null,
      "rule": "VALIDATION_ARTIFACT_REFERENCE_REQUIRED",
      "detail": "basis=['EVAL-AI-001']"
    },
    {
      "assertion": "exact_required_transform_whitelist",
      "status": "PASS",
      "field": "workload",
      "destination": null,
      "rule": "EXACT_REQUIRED_NO_LOSSY_TRANSFORM",
      "detail": "method=PASS_THROUGH"
    },
    {
      "assertion": "internal_only_external_destination_blocked",
      "status": "PASS",
      "field": "workload",
      "destination": null,
      "rule": "INTERNAL_ONLY_NO_EXTERNAL_DESTINATION",
      "detail": "external_destinations=[]"
    },
    {
      "assertion": "transform_method_allowed_for_requirement",
      "status": "PASS",
      "field": "workload",
      "destination": null,
      "rule": "TRANSFORM_METHOD_REQUIREMENT_COMPATIBILITY",
      "detail": "method=PASS_THROUGH requirement=EXACT_REQUIRED"
    },
    {
      "assertion": "minimization_has_explicit_method_or_gap",
      "status": "PASS",
      "field": "workload",
      "destination": null,
      "rule": "MINIMIZATION_REQUIRES_EXPLICIT_METHOD_OR_CONTRACT_GAP",
      "detail": "method=PASS_THROUGH"
    },
    {
      "assertion": "external_response_not_pre_execution_request",
      "status": "PASS",
      "field": "workload",
      "destination": null,
      "rule": "SOURCE_PHASE_RESPONSE_SEPARATION",
      "detail": "source_phase=PRE_EXECUTION source_type=WORKLOAD_BINDING"
    },
    {
      "assertion": "trace_reference_present",
      "status": "PASS",
      "field": "workload",
      "destination": null,
      "rule": "TRACE_REFERENCE_REQUIRED",
      "detail": ""
    },
    {
      "assertion": "classification_basis_present",
      "status": "PASS",
      "field": "workload",
      "destination": null,
      "rule": "VALIDATION_ARTIFACT_REFERENCE_REQUIRED",
      "detail": "basis=['EVAL-AI-001']"
    },
    {
      "assertion": "exact_required_transform_whitelist",
      "status": "PASS",
      "field": "purpose",
      "destination": null,
      "rule": "EXACT_REQUIRED_NO_LOSSY_TRANSFORM",
      "detail": "method=PASS_THROUGH"
    },
    {
      "assertion": "internal_only_external_destination_blocked",
      "status": "PASS",
      "field": "purpose",
      "destination": null,
      "rule": "INTERNAL_ONLY_NO_EXTERNAL_DESTINATION",
      "detail": "external_destinations=[]"
    },
    {
      "assertion": "transform_method_allowed_for_requirement",
      "status": "PASS",
      "field": "purpose",
      "destination": null,
      "rule": "TRANSFORM_METHOD_REQUIREMENT_COMPATIBILITY",
      "detail": "method=PASS_THROUGH requirement=EXACT_REQUIRED"
    },
    {
      "assertion": "minimization_has_explicit_method_or_gap",
      "status": "PASS",
      "field": "purpose",
      "destination": null,
      "rule": "MINIMIZATION_REQUIRES_EXPLICIT_METHOD_OR_CONTRACT_GAP",
      "detail": "method=PASS_THROUGH"
    },
    {
      "assertion": "external_response_not_pre_execution_request",
      "status": "PASS",
      "field": "purpose",
      "destination": null,
      "rule": "SOURCE_PHASE_RESPONSE_SEPARATION",
      "detail": "source_phase=PRE_EXECUTION source_type=PURPOSE_BINDING"
    },
    {
      "assertion": "trace_reference_present",
      "status": "PASS",
      "field": "purpose",
      "destination": null,
      "rule": "TRACE_REFERENCE_REQUIRED",
      "detail": ""
    },
    {
      "assertion": "classification_basis_present",
      "status": "PASS",
      "field": "purpose",
      "destination": null,
      "rule": "VALIDATION_ARTIFACT_REFERENCE_REQUIRED",
      "detail": "basis=['EVAL-AI-001', 'EVAL-AI-004']"
    },
    {
      "assertion": "exact_required_transform_whitelist",
      "status": "PASS",
      "field": "requested_field_scope",
      "destination": null,
      "rule": "EXACT_REQUIRED_NO_LOSSY_TRANSFORM",
      "detail": "method=PASS_THROUGH"
    },
    {
      "assertion": "internal_only_external_destination_blocked",
      "status": "PASS",
      "field": "requested_field_scope",
      "destination": null,
      "rule": "INTERNAL_ONLY_NO_EXTERNAL_DESTINATION",
      "detail": "external_destinations=[]"
    },
    {
      "assertion": "transform_method_allowed_for_requirement",
      "status": "PASS",
      "field": "requested_field_scope",
      "destination": null,
      "rule": "TRANSFORM_METHOD_REQUIREMENT_COMPATIBILITY",
      "detail": "method=PASS_THROUGH requirement=EXACT_REQUIRED"
    },
    {
      "assertion": "minimization_has_explicit_method_or_gap",
      "status": "PASS",
      "field": "requested_field_scope",
      "destination": null,
      "rule": "MINIMIZATION_REQUIRES_EXPLICIT_METHOD_OR_CONTRACT_GAP",
      "detail": "method=PASS_THROUGH"
    },
    {
      "assertion": "external_response_not_pre_execution_request",
      "status": "PASS",
      "field": "requested_field_scope",
      "destination": null,
      "rule": "SOURCE_PHASE_RESPONSE_SEPARATION",
      "detail": "source_phase=PRE_EXECUTION source_type=REQUESTED_FIELD_SCOPE"
    },
    {
      "assertion": "trace_reference_present",
      "status": "PASS",
      "field": "requested_field_scope",
      "destination": null,
      "rule": "TRACE_REFERENCE_REQUIRED",
      "detail": ""
    },
    {
      "assertion": "classification_basis_present",
      "status": "PASS",
      "field": "requested_field_scope",
      "destination": null,
      "rule": "VALIDATION_ARTIFACT_REFERENCE_REQUIRED",
      "detail": "basis=['EVAL-AI-002', 'EVAL-AI-004']"
    },
    {
      "assertion": "exact_required_transform_whitelist",
      "status": "PASS",
      "field": "model_identifier",
      "destination": null,
      "rule": "EXACT_REQUIRED_NO_LOSSY_TRANSFORM",
      "detail": "method=PASS_THROUGH"
    },
    {
      "assertion": "internal_only_external_destination_blocked",
      "status": "PASS",
      "field": "model_identifier",
      "destination": null,
      "rule": "INTERNAL_ONLY_NO_EXTERNAL_DESTINATION",
      "detail": "external_destinations=['MODEL_PROVIDER']"
    },
    {
      "assertion": "transform_method_allowed_for_requirement",
      "status": "PASS",
      "field": "model_identifier",
      "destination": null,
      "rule": "TRANSFORM_METHOD_REQUIREMENT_COMPATIBILITY",
      "detail": "method=PASS_THROUGH requirement=EXACT_REQUIRED"
    },
    {
      "assertion": "minimization_has_explicit_method_or_gap",
      "status": "PASS",
      "field": "model_identifier",
      "destination": null,